<?xml version="1.0" encoding="UTF-8"?>
<xs:schema xmlns:xs="http://www.w3.org/2001/XMLSchema">

  <xs:element name="requests">
    <xs:complexType>
      <xs:sequence>
        <xs:element name="request" maxOccurs="unbounded">
          <xs:complexType>
            <xs:sequence>
              <xs:element name="email" type="xs:string"/>
              <xs:element name="importo" type="xs:decimal"/>
            </xs:sequence>
            <xs:attribute name="status" type="xs:string"/>
          </xs:complexType>
        </xs:element>
      </xs:sequence>
    </xs:complexType>
  </xs:element>

</xs:schema>
