<?xml version="1.0" encoding="UTF-8"?>
<requests xmlns:xsi="http://www.w3.org/2001/XMLSchema-instance" xsi:noNamespaceSchemaLocation="requests.xsd">
  <request status="Rifiutato">
    <email>fede@gmail.com</email>
    <importo>555</importo>
  </request>
  <request status="Rifiutato">
    <email>fede@gmail.com</email>
    <importo>-15210</importo>
  </request>
  <request status="Rifiutato">
    <email>fede@gmail.com</email>
    <importo>100</importo>
  </request>
</requests>
